{
  "$schema": "./packs-schema.json",
  "catalog_version": "0.17.0",
  "budget_warning_characters": 6000,
  "budget_limit_characters": 8000,
  "plugin_packs": [
    {
      "plugin": "measured-agent-platforms",
      "purpose": "Human-facing agent architecture, security, tooling, context, protocol, retrieval, and Google ADK workflows.",
      "skills": [
        "agent-context-state-memory-design",
        "agent-protocol-interoperability-review",
        "agent-tool-action-boundary-review",
        "agentic-system-security-review",
        "google-adk-engineering-profile",
        "retrieval-grounding-quality-review"
      ],
      "description_characters": 2309,
      "budget_status": "within-budget",
      "discovery_estimates": {
        "codex": 3053,
        "claude": 3059
      }
    },
    {
      "plugin": "measured-ai-systems",
      "purpose": "Optional AI evaluation, context reliability, and source-to-output conformance workflows.",
      "skills": [
        "agent-evaluation-design",
        "context-reliability-review",
        "source-output-conformance-audit"
      ],
      "description_characters": 1130,
      "budget_status": "within-budget",
      "discovery_estimates": {
        "codex": 1449,
        "claude": 1452
      }
    },
    {
      "plugin": "measured-engineering-build",
      "purpose": "Frame outcomes, design interfaces, plan vertical slices, and test behavior.",
      "skills": [
        "implementation-planning",
        "module-interface-design",
        "problem-framing",
        "test-driven-change",
        "test-strategy"
      ],
      "description_characters": 1301,
      "budget_status": "within-budget",
      "discovery_estimates": {
        "codex": 1785,
        "claude": 1790
      }
    },
    {
      "plugin": "measured-engineering-delivery",
      "purpose": "Coordinate bounded execution, isolated work, review handoffs, and delivery evidence.",
      "skills": [
        "acceptance-evidence-ledger",
        "finish-development-branch",
        "merge-conflict-reconciliation",
        "multi-agent-orchestration",
        "plan-execution",
        "prototype-spike",
        "request-code-review",
        "respond-to-code-review",
        "worktree-isolation"
      ],
      "description_characters": 2415,
      "budget_status": "within-budget",
      "discovery_estimates": {
        "codex": 3368,
        "claude": 3377
      }
    },
    {
      "plugin": "measured-engineering-review",
      "purpose": "Review correctness, compatibility, security, operations, and test quality.",
      "skills": [
        "accessibility-review",
        "api-contract-compatibility-review",
        "application-security-review",
        "code-change-review",
        "data-migration-readiness",
        "dependency-supply-chain-review",
        "functional-motion-review",
        "observability-design",
        "operational-readiness-review",
        "performance-scalability-diagnosis",
        "test-quality-review"
      ],
      "description_characters": 2750,
      "budget_status": "within-budget",
      "discovery_estimates": {
        "codex": 3973,
        "claude": 3984
      }
    },
    {
      "plugin": "measured-operations",
      "purpose": "Portable requirements, decision, measurement, adoption, and incident workflows.",
      "skills": [
        "change-adoption-planning",
        "cross-capability-dependency-mapping",
        "data-authority-migration-ratification",
        "decision-governance-records",
        "iteration-postlaunch-learning",
        "kpi-outcome-measurement",
        "production-incident-analysis",
        "requirements-synthesis",
        "stakeholder-technical-communication",
        "value-attribution-evidence-maturity",
        "workshop-planning-synthesis"
      ],
      "description_characters": 2570,
      "budget_status": "within-budget",
      "discovery_estimates": {
        "codex": 3797,
        "claude": 3808
      }
    },
    {
      "plugin": "measured-reasoning",
      "purpose": "Portable alignment, explanation, impact, writing, evidence, and skill-authoring workflows.",
      "skills": [
        "alignment-interview",
        "change-impact-analysis",
        "codebase-explanation",
        "decision-evidence-trace",
        "design-rationale-investigation",
        "domain-vocabulary-modeling",
        "guided-configuration",
        "high-signal-technical-writing",
        "portable-skill-authoring",
        "task-handoff",
        "workflow-retrospective"
      ],
      "description_characters": 3171,
      "budget_status": "within-budget",
      "discovery_estimates": {
        "codex": 4237,
        "claude": 4248
      }
    },
    {
      "plugin": "measured-skills",
      "purpose": "Portable evidence, diagnosis, quality, publication, and skill-security workflows.",
      "skills": [
        "authority-boundary-review",
        "claim-verification",
        "cross-stack-quality-gates",
        "finding-consolidation",
        "prelaunch-readiness",
        "public-private-boundary-review",
        "publish-change-safely",
        "research-to-publication-lifecycle",
        "skill-import-provenance",
        "skill-security-review",
        "source-grounded-research",
        "systematic-diagnosis"
      ],
      "description_characters": 3321,
      "budget_status": "within-budget",
      "discovery_estimates": {
        "codex": 4469,
        "claude": 4481
      }
    },
    {
      "plugin": "measured-stack-profiles",
      "purpose": "Optional language and infrastructure engineering profiles.",
      "skills": [
        "adobe-aem-engineering-profile",
        "csharp-dotnet-engineering-profile",
        "go-engineering-profile",
        "java-spring-engineering-profile",
        "php-drupal-engineering-profile",
        "postgresql-sql-engineering-profile",
        "python-engineering-profile",
        "salesforce-apex-engineering-profile",
        "swift-swiftui-engineering-profile",
        "terraform-engineering-profile",
        "typescript-javascript-engineering-profile"
      ],
      "description_characters": 2803,
      "budget_status": "within-budget",
      "discovery_estimates": {
        "codex": 4116,
        "claude": 4127
      }
    }
  ],
  "recipes": [
    {
      "id": "secure-an-agent-system",
      "purpose": "Review agent context, tools, and system-wide security boundaries.",
      "skills": [
        "agent-context-state-memory-design",
        "agent-tool-action-boundary-review",
        "agentic-system-security-review"
      ],
      "description_characters": 1126,
      "budget_status": "within-budget",
      "installation_claim": "composition-only"
    },
    {
      "id": "review-a-google-adk-system",
      "purpose": "Review an exact-version Google ADK design, its evaluation contract, and its agentic security boundaries.",
      "skills": [
        "google-adk-engineering-profile",
        "agent-evaluation-design",
        "agentic-system-security-review"
      ],
      "description_characters": 1168,
      "budget_status": "within-budget",
      "installation_claim": "composition-only"
    },
    {
      "id": "verify-a-completion-claim",
      "purpose": "Verify a material completion claim and preserve acceptance evidence.",
      "skills": [
        "claim-verification",
        "acceptance-evidence-ledger"
      ],
      "description_characters": 587,
      "budget_status": "within-budget",
      "installation_claim": "composition-only"
    },
    {
      "id": "plan-a-safe-code-change",
      "purpose": "Frame and plan a code change with risk-based testing.",
      "skills": [
        "problem-framing",
        "implementation-planning",
        "test-strategy"
      ],
      "description_characters": 760,
      "budget_status": "within-budget",
      "installation_claim": "composition-only"
    },
    {
      "id": "review-a-public-release",
      "purpose": "Review a change for public exposure and publication readiness.",
      "skills": [
        "public-private-boundary-review",
        "prelaunch-readiness",
        "publish-change-safely"
      ],
      "description_characters": 789,
      "budget_status": "within-budget",
      "installation_claim": "composition-only"
    },
    {
      "id": "diagnose-with-evidence",
      "purpose": "Diagnose a defect and verify the resulting claims.",
      "skills": [
        "systematic-diagnosis",
        "claim-verification"
      ],
      "description_characters": 491,
      "budget_status": "within-budget",
      "installation_claim": "composition-only"
    },
    {
      "id": "review-an-ai-workflow",
      "purpose": "Design AI evaluations and review the reliability of supplied context.",
      "skills": [
        "agent-evaluation-design",
        "context-reliability-review",
        "source-output-conformance-audit"
      ],
      "description_characters": 1130,
      "budget_status": "within-budget",
      "installation_claim": "composition-only"
    },
    {
      "id": "review-a-service-release",
      "purpose": "Review application controls and operational readiness before release.",
      "skills": [
        "application-security-review",
        "operational-readiness-review",
        "observability-design"
      ],
      "description_characters": 815,
      "budget_status": "within-budget",
      "installation_claim": "composition-only"
    },
    {
      "id": "write-a-decision-brief",
      "purpose": "Ground a decision in sources and communicate it for its intended audience.",
      "skills": [
        "source-grounded-research",
        "decision-governance-records",
        "stakeholder-technical-communication"
      ],
      "description_characters": 734,
      "budget_status": "within-budget",
      "installation_claim": "composition-only"
    },
    {
      "id": "learn-after-launch",
      "purpose": "Connect observed outcomes and incidents to a bounded next decision.",
      "skills": [